{
  "$schema": "https://json-schema.org/draft/2020-12/schema",
  "$id": "https://raw.githubusercontent.com/130U/portfolio/main/schemas/post.schema.json",
  "title": "Portfolio post metadata",
  "description": "Metadata contract for a bilingual article, research note, or reflection in the portfolio.",
  "type": "object",
  "additionalProperties": false,
  "required": [
    "schemaVersion",
    "id",
    "seriesNo",
    "slug",
    "collection",
    "status",
    "publishedAt",
    "updatedAt",
    "featured",
    "readingMinutes",
    "sourceLanguage",
    "languages",
    "topics"
  ],
  "properties": {
    "schemaVersion": {
      "description": "Version of this metadata contract.",
      "const": 1
    },
    "id": {
      "description": "Stable identifier that does not change when the title or URL changes.",
      "type": "string",
      "minLength": 1,
      "maxLength": 100,
      "pattern": "^[a-z0-9]+(?:[.-][a-z0-9]+)*$"
    },
    "seriesNo": {
      "description": "Positive sequence number used to order the public body of work.",
      "type": "integer",
      "minimum": 1
    },
    "slug": {
      "description": "URL-safe, lowercase, kebab-case post slug.",
      "type": "string",
      "minLength": 1,
      "maxLength": 120,
      "pattern": "^[a-z0-9]+(?:-[a-z0-9]+)*$"
    },
    "collection": {
      "type": "string",
      "enum": ["article", "research", "reflection"]
    },
    "status": {
      "type": "string",
      "enum": ["draft", "review", "published"]
    },
    "publishedAt": {
      "description": "Publication timestamp, or null until the post is published.",
      "oneOf": [
        {
          "type": "string",
          "format": "date-time"
        },
        {
          "type": "null"
        }
      ]
    },
    "updatedAt": {
      "type": "string",
      "format": "date-time"
    },
    "featured": {
      "type": "boolean"
    },
    "readingMinutes": {
      "type": "integer",
      "minimum": 1
    },
    "sourceLanguage": {
      "description": "Language in which the post was originally written.",
      "type": "string",
      "enum": ["zh-CN", "en"]
    },
    "languages": {
      "description": "Required localized source files and display metadata.",
      "type": "object",
      "additionalProperties": false,
      "required": ["zh-CN", "en"],
      "properties": {
        "zh-CN": {
          "allOf": [
            { "$ref": "#/$defs/languageEntry" },
            { "type": "object", "properties": { "file": { "const": "README.zh-CN.md" } } }
          ]
        },
        "en": {
          "allOf": [
            { "$ref": "#/$defs/languageEntry" },
            { "type": "object", "properties": { "file": { "const": "README.en.md" } } }
          ]
        }
      }
    },
    "topics": {
      "type": "array",
      "minItems": 1,
      "maxItems": 20,
      "uniqueItems": true,
      "items": {
        "type": "string",
        "minLength": 1,
        "maxLength": 60
      }
    },
    "paper": {
      "$ref": "#/$defs/paper"
    },
    "audit": {
      "$ref": "#/$defs/audit"
    }
  },
  "allOf": [
    {
      "if": {
        "properties": {
          "status": {
            "const": "published"
          }
        },
        "required": ["status"]
      },
      "then": {
        "type": "object",
        "required": ["audit"],
        "properties": {
          "publishedAt": {
            "type": "string",
            "format": "date-time"
          },
          "audit": {
            "allOf": [
              { "$ref": "#/$defs/audit" },
              {
                "type": "object",
                "required": ["reviewedAt", "openIssueCount"],
                "properties": {
                  "status": { "const": "passed" },
                  "reviewedAt": { "type": "string", "format": "date-time" },
                  "openIssueCount": { "const": 0 }
                }
              }
            ]
          }
        }
      }
    }
  ],
  "$defs": {
    "relativeMarkdownPath": {
      "type": "string",
      "minLength": 4,
      "pattern": "^(?!/)(?![A-Za-z]:/)(?!.*(?:^|/)\\.\\.(?:/|$))[^\\\\]+\\.md$"
    },
    "languageEntry": {
      "type": "object",
      "additionalProperties": false,
      "required": ["file", "title", "summary"],
      "properties": {
        "file": {
          "$ref": "#/$defs/relativeMarkdownPath"
        },
        "title": {
          "type": "string",
          "minLength": 1,
          "maxLength": 240
        },
        "summary": {
          "type": "string",
          "minLength": 1,
          "maxLength": 1200
        }
      }
    },
    "paper": {
      "type": "object",
      "additionalProperties": false,
      "required": ["title", "url"],
      "properties": {
        "title": {
          "type": "string",
          "minLength": 1,
          "maxLength": 500
        },
        "authors": {
          "type": "array",
          "minItems": 1,
          "uniqueItems": true,
          "items": {
            "type": "string",
            "minLength": 1,
            "maxLength": 160
          }
        },
        "publishedAt": {
          "type": "string",
          "format": "date"
        },
        "venue": {
          "type": "string",
          "minLength": 1,
          "maxLength": 200
        },
        "url": {
          "type": "string",
          "format": "uri"
        },
        "arxivId": {
          "type": "string",
          "pattern": "^[0-9]{4}\\.[0-9]{4,5}(?:v[0-9]+)?$"
        },
        "doi": {
          "type": "string",
          "minLength": 3,
          "maxLength": 200
        }
      }
    },
    "audit": {
      "type": "object",
      "additionalProperties": false,
      "required": ["status", "file"],
      "properties": {
        "status": {
          "type": "string",
          "enum": ["pending", "passed", "needs-revision"]
        },
        "file": {
          "const": "AUDIT.md"
        },
        "reviewedAt": {
          "oneOf": [
            {
              "type": "string",
              "format": "date-time"
            },
            {
              "type": "null"
            }
          ]
        },
        "reviewedBy": {
          "type": "string",
          "minLength": 1,
          "maxLength": 160
        },
        "openIssueCount": {
          "type": "integer",
          "minimum": 0
        }
      }
    }
  }
}
