{
  "schemaVersion": 1,
  "id": "article.001",
  "seriesNo": 1,
  "slug": "from-vision-and-instructions-to-robot-actions",
  "collection": "article",
  "status": "published",
  "publishedAt": "2026-07-29T00:00:00-04:00",
  "updatedAt": "2026-08-03T00:00:00-04:00",
  "featured": true,
  "readingMinutes": 12,
  "sourceLanguage": "en",
  "languages": {
    "zh-CN": {
      "file": "README.zh-CN.md",
      "title": "从视觉与指令到机器人动作：两条正在形成的路径",
      "summary": "以训练目标、中间表征和推理时计算为线索，比较 VLM→VLA 与视频／世界模型→动作两条机器人控制路径。"
    },
    "en": {
      "file": "README.en.md",
      "title": "From Vision and Instructions to Robot Actions: Two Emerging Paths",
      "summary": "A practical taxonomy for VLM-to-VLA and video/world-model-to-action systems, organized by training targets, internal representations, and inference-time computation."
    }
  },
  "topics": [
    "Robotics",
    "Embodied AI",
    "Vision-Language-Action",
    "World-Action Models"
  ],
  "audit": {
    "status": "passed",
    "file": "AUDIT.md",
    "reviewedAt": "2026-08-03T00:00:00-04:00",
    "reviewedBy": "Codex structural audit",
    "openIssueCount": 0
  }
}
