{
  "schemaVersion": 1,
  "id": "research.002",
  "seriesNo": 2,
  "slug": "manifold-world-model-landscape",
  "collection": "research",
  "status": "published",
  "publishedAt": "2026-07-14T00:00:00-04:00",
  "updatedAt": "2026-08-03T12:00:00-04:00",
  "featured": true,
  "readingMinutes": 24,
  "sourceLanguage": "zh-CN",
  "languages": {
    "zh-CN": {
      "file": "README.zh-CN.md",
      "title": "Manifold 海外世界模型竞争格局",
      "summary": "从 23 条线索收敛到五类风险路径，并保留 141 个来源、111 条原子主张与完整红队记录：一份结论先行、证据边界清楚的中文 desk research。"
    },
    "en": {
      "file": "README.en.md",
      "title": "Manifold and the Overseas World-Model Landscape",
      "summary": "A conclusion-first desk research case study that narrows 23 leads into five risk paths while preserving 141 sources, 111 atomic claims, and the full red-team trail."
    }
  },
  "topics": [
    "World Models",
    "Embodied AI",
    "Competitive Intelligence",
    "Research Methodology",
    "Agentic Research"
  ],
  "audit": {
    "status": "passed",
    "file": "AUDIT.md",
    "reviewedAt": "2026-08-03T15:00:00-04:00",
    "reviewedBy": "Codex structural audit",
    "openIssueCount": 0
  }
}
